recipe_id,name,minutes,contributor_id,tags,nutrition,n_steps,steps,ingredients,n_ingredients,ingredient_ids,ingredient_tokens,month,year,num_comments,avg_ratings,season
427904,roasted watermelon seeds,30,223979,"['30-minutes-or-less', 'time-to-make', 'course', 'preparation', 'for-1-or-2', '5-ingredients-or-less', 'lunch', 'easy', 'dietary', 'high-protein', 'high-in-something', 'number-of-servings']","[300.8, 39.0, 0.0, 147.0, 30.0, 26.0, 2.0]",16,"['preparation:', 'gather seeds from watermelon and place in colander', 'be sure to use only the black seeds', 'do not use the small , white seeds', 'rinse thoroughly in colander to remove any excess watermelon', 'once clean , spread out in an even layer on a cookie sheet and allow to dry', 'drying outdoors in direct sunlight is a good method', 'seeds can be patted dry , but roast much better when they are completely dry', 'in a frying pan on the stovetop , place watermelon seeds on medium high heat and turn until seeds are roasted', 'in a cup of water , add salt and stir until dissolved', 'pour salt water into frying pan and stir occasionally until water has evaporated', 'once done , allow seeds to cool completely before shelling and eating', 'watermelon seeds can also be toasted in the oven at 325 degrees for 15-20 minutes', 'wash and dry as above', 'spray seeds with cooking spray and sprinkle evenly with salt', 'allow to cool completely before eating']","['watermelon seeds', 'salt', 'water']",3,,,6,2010,1,5.0,summer
209006,hungarian dumplings,30,307577,"['30-minutes-or-less', 'time-to-make', 'course', 'main-ingredient', 'cuisine', 'preparation', 'low-protein', 'healthy', 'side-dishes', 'hungarian', 'easy', 'european', 'low-fat', 'dietary', 'low-sodium', 'low-cholesterol', 'low-saturated-fat', 'low-calorie', 'low-carb', 'low-in-something', 'pasta-rice-and-grains']","[398.5, 16.0, 1.0, 64.0, 24.0, 20.0, 20.0]",11,"['using an electric mixer , blend the eggs , lard or oil , water , and milk', 'stir the flour together with 1 / 2 t of the salt and the baking powder in a dry bowl', 'blend this mixture into the liquid', 'mix well and set aside for a moment', 'bring 4 quarts of water to a boil and add 2 teaspoons of salt', 'using a spaetzle maker or spaetzle press , squeeze the dough into the boiling water', 'use about 1 / 3 of the dough for each batch', 'when the dumplings float to the surface , they are done', 'remove them with a slotted spoon and place in a colander', 'they can be served this way with paprika gravy or pan-fried with a little butter , just until they are a bit golden , and topped with parsley', 'the latter takes much much longer']","['eggs', 'freshly rendered lard', 'water', 'milk', 'all-purpose flour', 'salt', 'baking powder']",7,"[2499, 6046, 7655, 4717, 63, 6270, 332]","[[6812], [10767, 15716, 21653], [1353], [5940], [589, 260, 4001, 17918], [6953], [15473, 8361]]",2,2007,1,5.0,winter
84992,glazed vegetable stir fry,15,66321,"['15-minutes-or-less', 'time-to-make', 'course', 'main-ingredient', 'preparation', 'low-protein', 'healthy', 'side-dishes', 'vegetables', 'vegan', 'vegetarian', 'dietary', 'low-sodium', 'low-cholesterol', 'low-saturated-fat', 'low-calorie', 'stir-fry', 'low-carb', 'healthy-2', 'low-in-something', 'broccoli', 'technique']","[109.6, 7.0, 33.0, 6.0, 4.0, 3.0, 5.0]",6,"['in small bowl , combine sugar , lemon zest , lemon juice , soy sauce , water and cornstarch , and set aside', 'heat oil over high heat in large , non-stick skillet', 'add broccoli and red pepper , stir-fry for two minutes', 'add jicama , and continue to cook until vegetables are crisp-tender', 'pour liquid mixture over vegetables and cook until thickened', 'thoroughly coat vegetables with glaze , garnish with additional lemon zest and serve']","['sugar', 'lemon, zest of', 'low sodium soy sauce', 'lemon juice', 'cornstarch', 'water', 'cooking oil', 'broccoli florets', 'red bell pepper', 'jicama']",10,"[6906, 4289, 6696, 4253, 1833, 7655, 1783, 761, 5915, 3994]","[[6444], [13249, 240, 36, 965, 498], [954, 39292, 37754, 10734], [13249, 7524], [9230, 789, 607], [1353], [6913, 6020], [32043, 1174, 23996], [978, 4178, 11332], [28, 572, 11089]]",2,2004,2,4.5,winter
174149,down home beef skillet,20,53959,"['30-minutes-or-less', 'time-to-make', 'course', 'main-ingredient', 'preparation', 'main-dish', 'beef', 'rice', 'easy', 'one-dish-meal', 'ground-beef', 'meat', 'pasta-rice-and-grains', 'white-rice', '3-steps-or-less']","[303.8, 12.0, 17.0, 18.0, 41.0, 15.0, 12.0]",8,"['brown beef and onion in a large skillet until no longer pink , drain', 'add remaining ingredients except peas', 'bring to a boil', 'cook 2 minutes', 'blend in peas', 'cover and remove from heat', 'let stand 5 minutes', 'serve']","['lean ground beef', 'onion', 'water', 'salsa', 'mexican-style corn', 'tomatoes in puree', 'quick-cooking rice', 'peas']",8,"[4189, 5010, 7655, 6265, 1803, 7238, 6061, 5224]","[[4334, 1430, 11434], [21453], [1353], [31843], [12432, 260, 4530, 8289], [19811, 500, 673, 944], [2279, 260, 6913, 6878], [22075]]",6,2006,1,5.0,summer
354640,french gorton spread,65,548123,"['time-to-make', 'main-ingredient', 'preparation', '5-ingredients-or-less', 'easy', 'meat', '3-steps-or-less', '4-hours-or-less']","[518.8, 54.0, 4.0, 5.0, 88.0, 65.0, 1.0]",4,"['put all ingredients into an uncovered deep saucepan and simmer for about 2 hours', 'keep mashing down', 'pour into a bowl and let sit overnight', 'skim off any excess fat and spread for sandwhiches']","['ground pork', 'onion', 'cinnamon', 'clove', 'salt and pepper']",5,"[3533, 5010, 1511, 1563, 6276]","[[1430, 12395], [21453], [15341], [796, 527], [6953, 488, 11332]]",2,2009,1,0.0,winter
266788,braised fennel pugliese,25,182010,"['30-minutes-or-less', 'time-to-make', 'course', 'main-ingredient', 'cuisine', 'preparation', 'low-protein', 'appetizers', 'side-dishes', 'vegetables', 'european', 'italian', 'dietary', 'low-cholesterol', 'low-saturated-fat', 'low-calorie', 'low-carb', 'healthy-2', 'low-in-something']","[141.5, 15.0, 0.0, 11.0, 7.0, 6.0, 3.0]",11,"['bring pot of water to a rolling boil', 'drop in fennel quarters or whole ""baby"" bulbs', 'return to boil and cook , uncovered , for about 10 minutes , until the fennel is tender', 'drain and set aside', 'in a frying pan large enough to hold all the fennel , heat olive oil over medium-low heat and add garlic , anchovies and chile pepper', 'cook gently until garlic has softened', 'mash the anchovy bits into the oil to make a paste', 'add fennel and continue cooking , stirring to coat the fennel with the garlicky , peppery oil', 'cook together , stirring occasionally , for an additional 5 minutes', 'spoon fennel from pan onto a serving plate , and sprinkle with freshly ground pepper', 'serve hot , or let cool to slightly warmer than room temperature']","['fennel bulbs', 'extra virgin olive oil', 'garlic cloves', 'anchovy fillets', 'dried red chili pepper', 'fresh ground black pepper']",6,"[2584, 5006, 3203, 125, 2343, 2816]","[[8352, 3098, 18193], [4019, 9080, 10444, 6020], [15022, 796, 964], [480, 1277, 1725, 2226, 3531], [6167, 978, 22942, 11332], [3137, 1430, 1301, 11332]]",11,2007,1,5.0,autumn
44950,hot crab spread,30,37636,"['30-minutes-or-less', 'time-to-make', 'course', 'main-ingredient', 'cuisine', 'preparation', 'occasion', 'north-american', 'for-large-groups', 'appetizers', 'eggs-dairy', 'seafood', 'vegetables', 'american', 'oven', 'easy', 'dinner-party', 'holiday-event', 'kid-friendly', 'spreads', 'crab', 'cheese', 'dietary', 'new-years', 'shellfish', 'equipment', 'number-of-servings', 'presentation', 'served-hot']","[46.0, 5.0, 0.0, 0.0, 6.0, 10.0, 0.0]",5,"['preheat oven to 325 degrees f', 'mix together all ingredients except paprika and place in a small casserole dish', 'sprinkle the top with paprika', 'bake for 20 minutes at 325 degrees f or until hot', 'serve with crackers , if desired']","['crabmeat', 'swiss cheese', 'green onions', 'mayonnaise', 'lemon juice', 'worcestershire sauce', 'paprika']",7,"[1866, 7033, 6335, 4623, 4253, 7946, 5168]","[[38018, 5089], [16771, 6821], [2056, 19414], [1061, 494, 813, 2141], [13249, 7524], [652, 25, 3035, 11959, 10734], [712, 941, 3012]]",10,2002,2,5.0,autumn
253120,braised rabbit  italian style,180,514811,"['time-to-make', 'course', 'main-ingredient', 'cuisine', 'preparation', 'very-low-carbs', 'main-dish', 'european', 'italian', 'dietary', 'high-protein', 'low-carb', 'high-in-something', 'low-in-something', 'meat', '4-hours-or-less']","[417.8, 33.0, 5.0, 42.0, 91.0, 25.0, 0.0]",12,"['rinse the rabbit pieces in cold water and pat dry', 'in a deep wide skillet with a lid , put the oil , celery , garlic , and the rabbit in a single layer', 'cover and simmer over low heat for about 2 hours', 'turn the meat once or twice', 'if some of the ingredients begin to scorch , add a little water', 'after 2 hours , the rabbit may have thrown off a lot of liquid', 'uncover the pan , turn the heat up to medium , and cook until the liquid has evaporated , turning the meat from time to time', 'add the wine , rosemary , salt and pepper', 'simmer , uncovered , until the wine has evaporated', 'dissolve the bouillon cube , tomato paste , and sugar in the warm water', 'pour it over the rabbit , and cook gently for another 12 to 15 minutes , basting and turning the rabbit two or three times', 'serve immediately , accompanied by polenta if desired']","['rabbit', 'light olive oil', 'celery', 'garlic clove', 'dry white wine', 'rosemary', 'salt', 'fresh ground black pepper', 'warm water', 'bouillon cube', 'tomato paste', 'sugar', 'polenta']",13,"[5801, 5006, 1124, 3203, 2461, 6183, 6270, 2816, 7650, 693, 7229, 6906, 5528]","[[8486], [1092, 10444, 6020], [38139], [15022, 796, 527], [2832, 1454, 3204], [17841], [6953], [3137, 1430, 1301, 11332], [2107, 1353], [6168, 4386, 504, 15684], [16954, 16064], [6444], [644, 2138, 2338]]",9,2007,1,5.0,autumn
63414,carrot hamburger soup,80,41468,"['weeknight', 'time-to-make', 'course', 'main-ingredient', 'preparation', 'soups-stews', 'beef', 'vegetables', 'easy', 'dietary', 'inexpensive', 'ground-beef', 'meat', 'carrots', '3-steps-or-less', '4-hours-or-less']","[206.2, 18.0, 21.0, 44.0, 24.0, 21.0, 4.0]",3,"['put all ingredients in crockpot or stock pot', 'cook in crockpot on low all day or in stock pot 1 hour or more till veggies are tender', 'add water as necessary to reach desired thickness']","['salt', 'celery', 'green pepper', 'tomato juice', 'water', 'carrots', 'marjoram', 'garlic', 'pepper', 'sugar', 'cream of celery soup', 'ground beef']",12,"[6270, 1124, 3440, 7227, 7655, 1093, 4585, 3184, 5319, 6906, 1914, 3484]","[[6953], [38139], [2056, 11332], [16954, 7524], [1353], [21570], [831, 4348, 1048], [15022], [11332], [6444], [4914, 498, 38139, 8294], [1430, 11434]]",5,2003,2,4.5,spring
186456,tuscan yam salad,90,226084,"['time-to-make', 'course', 'main-ingredient', 'cuisine', 'preparation', 'yams-sweet-potatoes', 'north-american', 'side-dishes', 'potatoes', 'vegetables', 'canadian', 'easy', 'british-columbian', '3-steps-or-less', '4-hours-or-less']","[354.3, 15.0, 12.0, 11.0, 14.0, 16.0, 20.0]",6,"['roast the yams in a little olive oil in a 375-400 oven until soft and a little brown on the outside , about 30 minutes', 'cool', 'mix remaining ingredients except for the pine nuts and cheese , and toss with the yams', 'crumble in the cheese', 'allow to sit in the fridge at least an hour to let the flavours develop', 'add pine nuts just before serving to keep them crunchy']","['yams', 'roasted garlic', 'caramelized onion', 'sun-dried tomatoes', 'fresh basil', 'fresh ground black pepper', 'balsamic vinegar', 'lemon rind', 'pine nuts', 'feta cheese']",10,"[7955, 6117, 1077, 6926, 2757, 2816, 339, 4267, 5407, 2591]","[[5450, 924], [19642, 15022], [857, 1574, 1299, 1065, 21453], [2104, 260, 6167, 19811], [3137, 20323], [3137, 1430, 1301, 11332], [1742, 540, 5809, 26285], [13249, 17, 686], [7386, 7327], [629, 2338, 6821]]",9,2006,3,1.6666666666666667,autumn
427616,smorgastarta   swedish sandwich torte,35,852554,"['60-minutes-or-less', 'time-to-make', 'preparation', 'easy', '3-steps-or-less']","[463.6, 33.0, 23.0, 26.0, 53.0, 43.0, 14.0]",8,"['mix sour cream , lemon zest and juice in a medium bowl', 'combine eggs , dill , onion and capers in another medium bowl', 'stir in half of the sour cream mixture', 'add trout , celery , parsley , caraway seeds and pepper to the remaining sour cream mixture', 'to assemble sandwiches: divide the egg mixture among 4 slices of bread', 'top with bread , then spread with the trout mixture', 'top with the remaining bread', 'cut each sandwich in half and serve']","['sour cream', 'lemon zest', 'lemon juice', 'hard-boiled eggs', 'fresh dill', 'red onion', 'capers', 'smoked trout', 'celery', 'parsley', 'caraway seed', 'fresh ground pepper', 'whole wheat bread']",13,"[6654, 4284, 4253, 3625, 2794, 5966, 1049, 6591, 1124, 5185, 1078, 2817, 7872]","[[9514, 4914], [13249, 36, 965], [13249, 7524], [1162, 260, 12193, 6812], [3137, 18594], [978, 21453], [1564, 650], [12227, 25237], [38139], [734, 5612], [857, 841, 10107], [3137, 1430, 11332], [1657, 17004, 5339]]",5,2010,2,5.0,spring
393461,spicy curry pumpkin soup,40,1398976,"['60-minutes-or-less', 'time-to-make', 'course', 'main-ingredient', 'preparation', 'occasion', 'low-protein', 'bisques-cream-soups', 'soups-stews', 'vegetables', 'dinner-party', 'fall', 'winter', 'dietary', 'low-sodium', 'seasonal', 'low-calorie', 'low-carb', 'low-in-something', 'squash']","[273.7, 22.0, 68.0, 21.0, 15.0, 44.0, 10.0]",16,"['melt butter in a 4-quart saucepan over mediium-high heat', 'add onions and garlic and cook , stirring often until softened , about 4 minutes', 'add spices and stir for a minute more', 'add pumpkin and 5 cups of chicken broth', 'blend well', 'bring to a boil and reduce heat , simmer for 10 to 15 minutes', 'transfer soup , in batches , to a blender or food processor', 'cover tightly and blend until smooth', 'return soup to saucepan', 'with the soup on low heat , add brown sugar and mix', 'slowly add milk while stirring to incorporate', 'add cream', 'adjust seasonings to taste', 'if a little too spicy , add more cream to cool it down', 'you might want to add a teaspoon of salt', 'garnish with toasted pumpkin seeds and / or sour cream']","['unsalted butter', 'yellow onions', 'minced garlic cloves', 'crushed red pepper flakes', 'curry powder', 'ground coriander', 'ground cayenne pepper', 'pumpkin puree', 'chicken broth', 'milk', 'brown sugar', 'heavy cream']",12,"[7367, 7979, 4740, 1986, 2022, 3500, 3490, 5760, 1257, 4717, 800, 3668]","[[563, 31331, 8780], [3484, 19414], [878, 940, 15022, 796, 964], [6945, 978, 11332, 14071], [20994, 8361], [1430, 1055, 11, 4364], [1430, 25845, 8111, 11332], [18376, 673, 944], [5867, 24176], [5940], [2507, 6444], [2262, 4914]]",10,2009,3,4.666666666666667,autumn
64827,mango meringue pie,60,72804,"['60-minutes-or-less', 'time-to-make', 'course', 'main-ingredient', 'preparation', 'pies-and-tarts', 'tarts', 'beverages', 'desserts', 'fruit', 'oven', 'refrigerator', 'pies', 'dietary', 'tropical-fruit', 'mango', 'equipment']","[219.3, 3.0, 127.0, 3.0, 6.0, 2.0, 15.0]",11,"['preheat oven to 180c', 'to make base blend flour , 1 / 4 cup sugar , and margarine in food processor', 'slowly add in nectar till combined', 'roll pastry out on lightly floured surface to fit a 243cm pie plate', 'coat plate with cooking spray and using a rolling pin to lift pastry onto pie place , bake in oven until lightly browned', 'to make filling combine mango nectar , sugar and custard powder in a medium size saucepan and bring to boil stirring constantly till the mixture thickens', 'to make meringue in a medium size mixing bowl beat egg white on high speed until soft peaks form', 'gradually add in sugar , beating well until sugar has dissolved', 'to assemble pie , spread mango slices evenly over cook pastry', 'spoon over custard and top with meringue', 'bake for 10-15 minutes in a moderate oven until lightly browned']","['plain flour', 'reduced fat margarine', 'sugar', 'mango nectar', 'custard powder', 'mangoes', 'egg whites']",7,"[5495, 4574, 6906, 4549, 2025, 4544, 2509]","[[4204, 17918], [11197, 4739, 7424, 745], [6444], [26377, 25544], [39512, 8361], [923, 2993], [8441, 15953]]",6,2003,1,4.0,summer
41008,banana fudgicle,6,41799,"['15-minutes-or-less', 'time-to-make', 'course', 'main-ingredient', 'cuisine', 'preparation', 'north-american', 'for-1-or-2', 'beverages', 'fruit', 'american', 'easy', 'cocktails', 'food-processor-blender', 'dietary', 'equipment', 'small-appliance', 'number-of-servings']","[126.2, 10.0, 29.0, 1.0, 4.0, 20.0, 5.0]",9,"['pour the creme de cocoa into blender', 'toss in one very ripe banana', 'add in approximately 4 oz', 'half and half cream', 'put in 12 oz', 'ice cubes , the smaller the better', 'blend until thick and pour into 12 oz', 'tulip glasses', 'lightly sprinkle shaved chocolate on top']","['dark creme de cacao', 'banana', 'half-and-half', 'ice cubes', 'bittersweet chocolate']",5,"[2063, 342, 3589, 3829, 547]","[[1294, 977, 510, 596, 12536, 14099], [16296], [1444, 260, 488, 260, 1444], [755, 22118], [23874, 5317]]",9,2002,6,4.833333333333333,autumn
321879,reubenesque,20,386585,"['30-minutes-or-less', 'time-to-make', 'course', 'main-ingredient', 'preparation', 'occasion', 'lunch', 'poultry', 'easy', 'beginner-cook', 'holiday-event', 'turkey', 'christmas', 'thanksgiving', 'sandwiches', 'meat']","[473.6, 28.0, 24.0, 29.0, 61.0, 34.0, 15.0]",8,"['preheat oven to 425 degrees fahrenheit', 'arrange bread sliced on a cookie sheet', 'bake 3 to 4 minutes per side until lightly toasted', 'spread each slice of toast with russian dressing', 'top 4 of the slices with turkey and cheese', 'bake 4 minutes or until cheese melts', 'top cheese with coleslaw and onion rings', 'cover with remaining toast']","['marbled rye bread', 'russian salad dressing', 'cooked turkey', 'swiss cheese', 'coleslaw', 'red onions']",6,"[4573, 2200, 1762, 7033, 1647, 5966]","[[831, 5431, 29273, 5339], [7468, 9540, 6089], [9649, 12038], [16771, 6821], [22733, 1573, 251], [978, 19414]]",8,2008,1,5.0,summer
481459,shrimp and cucumber salad with horseradish mayo,45,865936,"['60-minutes-or-less', 'time-to-make', 'course', 'main-ingredient', 'preparation', 'salads', 'seafood', 'vegetables', 'shrimp', 'shellfish']","[223.1, 21.0, 15.0, 30.0, 22.0, 10.0, 4.0]",10,"['make the horseradish mayonnaise by whisking together the mayonnaise , horseradish , vinegar , some salt , pepper , and more horseradish , if desired', 'fold in tarragon', 'line a baking sheet with paper towels to drain the shrimp once it is poached', 'in a large , wide pot , combine dill , shallot , peppercorns , bay leaf , 3 tablespoons salt , squeeze the juice from both lemon halves , then drop in the lemon halves', 'add 3 quarts of water and bring to a boil', 'reduce heat to medium and let poaching liquid simmer for 10 minutes', 'working in batches , place the shrimp in a sieve , lower into the poaching liquid , shaking now and then , until shrimp begins to curl and turn opaque , 15-20 seconds', 'transfer to paper towels to cool', 'combine cucumber , cooled shrimp , and 1 / 4 cup of the horseradish mayonnaise and fold to coat', 'season with salt , pepper , and more horseradish , if desired']","['mayonnaise', 'prepared horseradish', 'white wine vinegar', 'kosher salt', 'fresh ground black pepper', 'fresh tarragon', 'fresh dill', 'shallot', 'black peppercorns', 'bay leaf', 'lemon', 'small shrimp', 'seedless cucumber']",13,"[4623, 3758, 7803, 4096, 2816, 2906, 2794, 6426, 591, 393, 4231, 6549, 6378]","[[1061, 494, 813, 2141], [3572, 1338, 21172, 5465], [1454, 3204, 26285], [3319, 6949, 6953], [3137, 1430, 1301, 11332], [3137, 2008, 565, 2113], [3137, 18594], [5541, 1322], [1301, 20745, 1055, 1561], [4933, 10448], [13249], [1220, 19888], [33192, 1101, 30710]]",6,2012,2,5.0,summer
90567,cheese sauce,15,129958,"['15-minutes-or-less', 'time-to-make', 'course', 'main-ingredient', 'preparation', 'low-protein', '5-ingredients-or-less', 'sauces', 'condiments-etc', 'eggs-dairy', 'easy', 'cheese', 'dietary', 'low-cholesterol', 'low-saturated-fat', 'low-calorie', 'low-carb', 'low-in-something', '3-steps-or-less']","[53.1, 4.0, 5.0, 24.0, 2.0, 3.0, 1.0]",3,"['combine all ingredients in a small sauce pan', 'heat till cheese is melted', 'serve over garden peas , baked or mashed potatoes or meats']","['dry onion soup mix', 'cream of mushroom soup', 'cheddar cheese']",3,,,5,2004,3,5.0,spring
164091,hamburger spinach casserole,40,37456,"['60-minutes-or-less', 'time-to-make', 'course', 'main-ingredient', 'cuisine', 'preparation', 'north-american', 'casseroles', 'main-dish', 'beef', 'oven', 'easy', 'beginner-cook', 'dietary', 'low-calorie', 'low-carb', 'inexpensive', 'ground-beef', 'low-in-something', 'meat', 'equipment']","[385.1, 33.0, 13.0, 51.0, 65.0, 46.0, 4.0]",7,"['preheat oven to 400f', 'in a non-stick fry pan , soften onion , then brown hamburger', 'add frozen spinach , cover and cook until spinach thaws , scraping spinach as it melts', 'stir in soup , soy sauce , pepper , cajun seasoning and 1 / 3 cup cheese', 'cook until cheese melts , then place in a greased 2-quart casserole', 'sprinkle with the 1 / 4 cup cheese and bread crumbs', 'bake at 400f for about 10 minutes or until cheese melts']","['lean ground beef', 'onion', 'frozen chopped spinach', 'cream of mushroom soup', 'soy sauce', 'black pepper', 'cajun seasoning', 'cheddar cheese', 'dry breadcrumbs']",9,"[4189, 5010, 2984, 1920, 6696, 590, 905, 1168, 2404]","[[4334, 1430, 11434], [21453], [4787, 17163, 34058], [4914, 498, 22193, 8294], [37754, 10734], [1301, 11332], [35662, 29471, 484], [30645, 4785, 6821], [2832, 31950, 17169]]",4,2006,5,4.2,spring
77824,prosciutto  mushroom and artichoke pizza,30,61660,"['30-minutes-or-less', 'time-to-make', 'course', 'main-ingredient', 'preparation', 'for-1-or-2', 'main-dish', 'eggs-dairy', 'vegetables', 'pizza', 'cheese', 'dietary', 'mushrooms', 'number-of-servings']","[340.0, 46.0, 16.0, 7.0, 18.0, 27.0, 3.0]",10,"['preheat oven to 425 degrees', 'in a frying pan , heat 2 tbsp of the oil', 'saute the scallions , mushrooms and garlic over moderate heat until all the juices have evaporated', 'salt and pepper lightly', 'let cool', 'brush the pizza dough with 1 tbsp oil', 'arrange the prosciutto , mushrooms and artichokes on top', 'sprinkle the parmesan over , then drizzle the remaining oil over and season again lightly with salt and pepper', 'bake for 15-20 minutes', 'serve immediately !']","['scallion', 'olive oil', 'mushrooms', 'garlic', 'pizza dough', 'prosciutto', 'artichoke hearts packed in oil', 'parmesan cheese', 'salt and black pepper']",9,"[6335, 5006, 4863, 3184, 5483, 5724, 206, 5180, 6274]","[[5703, 2825], [10444, 6020], [19104], [15022], [6856, 17532], [706, 2371, 16, 14041], [3418, 10382, 7438, 4960, 500, 6020], [734, 744, 3707, 6821], [6953, 488, 1301, 11332]]",12,2003,4,4.75,winter
196979,hot fudge upside down cake mix,60,384737,"['60-minutes-or-less', 'time-to-make', 'course', 'main-ingredient', 'preparation', 'occasion', 'low-protein', 'healthy', 'desserts', 'romantic', 'cakes', 'chocolate', 'dietary', 'gifts', 'low-cholesterol', 'low-saturated-fat', 'high-calcium', 'healthy-2', 'high-in-something', 'low-in-something', 'taste-mood']","[253.7, 6.0, 161.0, 13.0, 5.0, 5.0, 18.0]",12,"['mix dry cake ingredients together', 'flour , sugar , coco , baking powder , salt', 'place in zippy bag if storing as a mix and label', 'mix dry topping ingrediants together', 'brown sugar and coco', 'place in zippy bag if storing as a mix and label', 'to serve: in ungreased 9x9 pan stir together with a fork the dry cake mix and wet ingredients , spread mix even in pan', 'sprinkle dry topping on top of cake mix', 'gently pour on top 1 3 / 4 cups hottest tap water', 'this will make the fudge', 'cook at 350 for 40 minute', 'serve inverted toped with ice-cream']","['flour', 'sugar', 'cocoa powder', 'baking powder', 'salt', 'milk', 'oil', 'vanilla', 'brown sugar', 'tap water']",10,,,11,2006,1,4.0,autumn
133801,grilled chicken with balsamic peach marinade,55,225903,"['60-minutes-or-less', 'time-to-make', 'course', 'main-ingredient', 'preparation', 'occasion', 'main-dish', 'fruit', 'poultry', 'oven', 'barbecue', 'easy', 'summer', 'broil', 'chicken', 'dietary', 'seasonal', 'low-carb', 'low-in-something', 'pitted-fruit', 'peaches', 'meat', 'chicken-breasts', 'equipment', 'grilling', '3-steps-or-less']","[540.2, 62.0, 37.0, 18.0, 61.0, 38.0, 3.0]",5,"['combine vinegar , mustard , honey , salt , pepper , garlic , and thyme', 'whisk until well blended , then add olive oil and mix', 'just before you are ready to marinate chicken , stir in peaches', 'pour over chicken breasts', 'allow to marinate for at least 2 hours and grill']","['chicken breasts', 'fresh peach', 'balsamic vinegar', 'dijon mustard', 'honey', 'salt', 'ground black pepper', 'garlic', 'fresh thyme', 'olive oil']",10,"[1252, 2861, 339, 2148, 3723, 6270, 3486, 3184, 2909, 5006]","[[5867, 6285], [3137, 14762], [1742, 540, 5809, 26285], [592, 5552, 23488], [4017], [6953], [1430, 1301, 11332], [15022], [3137, 20930, 510], [10444, 6020]]",8,2005,7,3.4285714285714284,summer
