recipe_id,name,minutes,contributor_id,tags,nutrition,n_steps,steps,ingredients,n_ingredients,ingredient_ids,ingredient_tokens,month,year,num_comments,avg_ratings,season
106116,alton brown s cuban sandwich,20,22720,"['30-minutes-or-less', 'time-to-make', 'course', 'main-ingredient', 'cuisine', 'preparation', 'occasion', 'north-american', 'appetizers', 'main-dish', 'eggs-dairy', 'caribbean', 'central-american', 'dinner-party', 'holiday-event', 'kid-friendly', 'cuban', 'dietary', 'seasonal', 'high-protein', 'high-in-something', 'meat', 'novelty', 'number-of-servings']","[392.9, 27.0, 7.0, 52.0, 50.0, 43.0, 10.0]",10,"['slice the bread horizontally in half , leaving 1 edge intact', 'lay the bread open and spread each side with the mustard', 'divide the ingredients evenly among the slices of roll', 'start with the ham followed by the pork , cheese , and dill pickles', 'bring the tops and bottoms together', 'heat your panini maker or sandwich press', 'butter each side of the press', 'place the sandwiches inside , press down and grill until the cheese is melted and the bread is flat and browned , approximately 10 minutes', ""if you don't have a sandwich press , you can heat 6 fireplace bricks wrapped in foil , in a 500f oven for 1 hour and then press the sandwich between them for 10 minutes"", 'serve warm']","['hoagie rolls', 'yellow mustard', 'ham', 'roast pork', 'provolone cheese', 'dill pickle slices', 'unsalted butter']",7,"[3708, 7977, 3597, 6107, 5731, 5365, 7367]","[[548, 601, 2011, 5825], [3484, 23488], [3947], [14259, 12395], [706, 2296, 566, 6821], [18594, 25199, 15786], [563, 31331, 8780]]",12,2004,3,5.0,winter
204509,oprah s roasted butternut squash with sage,45,242161,"['lactose', '60-minutes-or-less', 'time-to-make', 'course', 'main-ingredient', 'cuisine', 'preparation', 'occasion', 'north-american', 'low-protein', 'side-dishes', 'vegetables', 'american', 'easy', 'beginner-cook', 'potluck', 'fall', 'holiday-event', 'vegan', 'vegetarian', 'winter', 'dietary', 'thanksgiving', 'low-sodium', 'gluten-free', 'low-cholesterol', 'seasonal', 'low-saturated-fat', 'low-calorie', 'healthy-2', 'free-of-something', 'low-in-something', 'squash', 'to-go', 'presentation', 'served-hot']","[95.8, 5.0, 12.0, 6.0, 3.0, 2.0, 5.0]",9,"['preheat oven to 350f', 'peel squash , cut off stem and 1 / 2 inch of bottom end', 'cut squash in half lengthwise', 'remove the seeds and pulp', 'place flat side down on a cutting board and slice into 1 / 2 inch pieces', 'mix sage , olive oil , garlic powder , pepper and salt in a bowl and toss squash pieces in the mixture until they are evenly coated', 'place squash pieces in a single layer on a large baking pan or dish', 'roast squash for 35-40 minutes or until tender and caramelized , flipping pieces half way through cooking', 'serve hot , garnished with a sprig of fresh or fried sage']","['butternut squash', 'fresh sage', 'extra virgin olive oil', 'salt', 'ground pepper', 'garlic powder']",6,"[875, 2882, 5006, 6270, 3532, 3217]","[[6796, 8619, 23841], [3137, 4532], [4019, 9080, 10444, 6020], [6953], [1430, 11332], [15022, 8361]]",1,2007,4,3.25,winter
100710,no bake corn flake cookies,45,164794,"['60-minutes-or-less', 'time-to-make', 'course', 'preparation', 'occasion', '5-ingredients-or-less', 'desserts', 'easy', 'winter', 'cookies-and-brownies', 'dietary', 'seasonal']","[1270.7, 67.0, 441.0, 34.0, 49.0, 45.0, 71.0]",6,"['in a large sauce pan combine corn syrup and sugar', 'bring to a boil and remove from heat', 'stir in the peanut butter', 'add the corn flakes', 'stir until corn flakes are covered with syrup mixture', 'drop tablespoons on wax paper']","['peanut butter', 'white corn syrup', 'granulated sugar', 'corn flakes']",4,"[5261, 7743, 3355, 1810]","[[14368, 8780], [1454, 8289, 17881], [4465, 29487, 6444], [8289, 14071]]",9,2004,21,4.380952380952381,autumn
202391,mocha cinnamon shake,8,169430,"['15-minutes-or-less', 'time-to-make', 'course', 'preparation', 'for-1-or-2', 'low-protein', 'beverages', 'easy', 'beginner-cook', 'dietary', 'low-sodium', 'low-cholesterol', 'shakes', 'low-calorie', 'low-carb', 'low-in-something', 'number-of-servings', '3-steps-or-less']","[225.1, 18.0, 67.0, 4.0, 13.0, 36.0, 8.0]",2,"['combine the gourmet coffee , ice cream , milk and crushed ice in a blender', 'blend it until it is all combined , pour into two mugs and add cinnamon sticks']","['brewed coffee', 'chocolate ice cream', 'milk', 'ice', 'cinnamon sticks', 'ground cinnamon']",6,,,12,2006,5,5.0,winter
320591,smoky chipotle and red tomato jam   chutney   relish,120,242729,"['time-to-make', 'course', 'main-ingredient', 'cuisine', 'preparation', 'occasion', 'north-american', 'jams-and-preserves', 'canning', 'lunch', 'condiments-etc', 'vegetables', 'american', 'mexican', 'southwestern-united-states', 'european', 'fall', 'picnic', 'summer', 'vegetarian', 'english', 'dietary', 'gifts', 'seasonal', 'sandwiches', 'oamc-freezer-make-ahead', 'onions', 'tomatoes', 'to-go', 'number-of-servings', 'presentation', 'served-cold', 'technique', 'unprocessed-freezer', '4-hours-or-less']","[687.7, 1.0, 580.0, 3.0, 15.0, 1.0, 55.0]",9,"['simmer for 1 hr , and then bring to a gentle boil so that the mixture turns dark , jammy and shiny', 'divide the hot jam / chutney between sterilised jars and set aside to cool', 'place a disc of waxed paper directly onto the jam / chutney and seal with airtight lids or cellophane and elastic bands', 'store in a cool , dry place , away from direct sunlight , for at least 1 month before eating', 'it will keep for up to 6 months', 'chill after opening and use within 1-2 months', 'how to sterilise jars: wash them thoroughly in hot , clean , soapy water , drain upside down on kitchen towel and place on a baking tray in a preheated oven at 140c / 280f / gas mark 1 for 15 minutes', 'turn the oven to its lowest setting and keep the jars inside while you make the jam / chutney', 'alternatively , you can wash them in a very hot cycle in your dishwasher and then proceed with the oven method as above']","['red onion', 'tomatoes', 'garlic cloves', 'fresh chili pepper', 'gingerroot', 'brown sugar', 'red wine vinegar', 'cardamom pods', 'chipotle chile']",9,,,8,2008,2,5.0,summer
32449,yellow squash saute,12,28995,"['15-minutes-or-less', 'time-to-make', 'course', 'main-ingredient', 'preparation', 'for-1-or-2', 'low-protein', '5-ingredients-or-less', 'side-dishes', 'vegetables', 'easy', 'stove-top', 'dietary', 'low-sodium', 'low-carb', 'low-in-something', 'equipment', 'number-of-servings']","[242.1, 35.0, 19.0, 8.0, 4.0, 73.0, 2.0]",5,"['slice the squash and onion', 'add to butter in frying pan', 'sprinkle with garlic salt and pepper as desired', 'saute until tender', 'serve hot']","['yellow squash', 'onion', 'butter', 'garlic salt', 'pepper']",5,"[7987, 5010, 840, 3219, 5319]","[[3484, 23841], [21453], [8780], [15022, 6953], [11332]]",6,2002,25,4.4,summer
145002,lemon bars with coconut shortbread crust,60,89831,"['60-minutes-or-less', 'time-to-make', 'course', 'main-ingredient', 'cuisine', 'preparation', 'occasion', 'desserts', 'fruit', 'oven', 'easy', 'european', 'beginner-cook', 'holiday-event', 'cookies-and-brownies', 'scottish', 'bar-cookies', 'nuts', 'food-processor-blender', 'christmas', 'thanksgiving', 'citrus', 'lemon', 'coconut', 'taste-mood', 'sweet', 'equipment', 'small-appliance']","[158.4, 11.0, 53.0, 3.0, 3.0, 23.0, 7.0]",14,"['set oven to 350', 'butter an 8 x 8-inch glass baking dish', 'to make the crust: combine flour , sugar and salt in a small processor', 'blend for about 5 seconds', 'add in flaked coconut and cold butter', 'process until mixture resembles fine meal and clumps together', 'press the dough over the bottom of prepared pan', 'bake for about 20 minutes or until crust is golden around the edges', 'in a medium bowl whisk together all the filling ingredients until smooth', 'remove the crust from the oven and pour the filling over the hot crust', 'return to the oven and bake until the filling begins to brown around the edges , and is just set and springy to the touch', 'cool the lemon bars completely before slicing', 'sift with powdered sugar', 'when the bars are completely cool , remove them with the foil overhang , my advise would be to place the bars in the fridge before removing them with the foil to avoid breakage of the crust']","['flour', 'powdered sugar', 'salt', 'butter', 'sweetened flaked coconut', 'sugar', 'eggs', 'fresh lemon juice', 'lemon peel', 'baking powder']",10,,,11,2005,2,2.0,autumn
377937,haricots verts salad,20,283251,"['30-minutes-or-less', 'time-to-make', 'course', 'main-ingredient', 'preparation', 'occasion', 'side-dishes', 'vegetables', 'summer', 'vegetarian', 'dietary', 'seasonal', 'inexpensive', 'green-yellow-beans']","[76.1, 7.0, 7.0, 5.0, 4.0, 2.0, 2.0]",14,"['heat oil and garlic in a small skillet over medium heat', 'cook 2 minutes , stirring occasionally', 'remove from heat', 'cool slightly', 'combine garlic mixture , 1 tablespoon nuts , vinegar , 1 / 4 teaspoon salt , pepper , and basil in a food processor', 'pulse until well combined', 'cook beans in boiling water 4 minutes or until crisp-tender', 'drain', 'rinse under cold water', 'drain', 'place in a large bowl', 'add basil mixture and remaining 1 / 4 teaspoon salt', 'toss to coat', 'sprinkle with 2 tablespoons nuts and tomatoes']","['extra virgin olive oil', 'garlic cloves', 'pine nuts', 'red wine vinegar', 'kosher salt', 'black pepper', 'basil leaves', 'french haricots vert', 'sun-dried tomatoes']",9,"[5006, 3203, 5407, 6009, 4096, 590, 384, 2725, 6926]","[[4019, 9080, 10444, 6020], [15022, 796, 964], [7386, 7327], [978, 3204, 26285], [3319, 6949, 6953], [1301, 11332], [20323, 3674], [4413, 1111, 572, 8868, 28346], [2104, 260, 6167, 19811]]",6,2009,2,5.0,summer
277243,jiffy chicken and cream of mushroom   a pantry recipe,6,465056,"['15-minutes-or-less', 'time-to-make', 'course', 'main-ingredient', 'preparation', 'occasion', 'healthy', '5-ingredients-or-less', 'bisques-cream-soups', 'soups-stews', 'poultry', 'easy', 'microwave', 'beginner-cook', 'chicken', 'dietary', 'low-cholesterol', 'low-calorie', 'low-carb', 'healthy-2', 'low-in-something', 'meat', 'to-go', 'camping', 'equipment', '3-steps-or-less']","[245.3, 22.0, 5.0, 40.0, 35.0, 20.0, 3.0]",2,"['mix soups , chicken and water and heat to boiling', 'serve immediately']","['condensed cream of mushroom soup', 'condensed cream of chicken soup', 'chicken breasts', 'water']",4,,,1,2008,1,5.0,winter
37120,baby carrots with lemon and parsley,15,36944,"['15-minutes-or-less', 'time-to-make', 'course', 'main-ingredient', 'preparation', 'low-protein', 'side-dishes', 'vegetables', 'dietary', 'low-sodium', 'low-calorie', 'low-carb', 'low-in-something']","[123.7, 13.0, 28.0, 6.0, 1.0, 27.0, 3.0]",5,"['put carrots in pan and cover with water', 'add the sugar and cook just til soft', 'drain& return to the pan', 'stir in butter , lemon juice and parsley', 'salt and pepper to taste']","['baby carrots', 'sugar', 'butter', 'lemon juice', 'parsley', 'salt', 'pepper']",7,"[269, 6906, 840, 4253, 5185, 6270, 5319]","[[1924, 21570], [6444], [8780], [13249, 7524], [734, 5612], [6953], [11332]]",8,2002,20,4.8,summer
144411,amy s mud puddles,51,47907,"['60-minutes-or-less', 'time-to-make', 'course', 'main-ingredient', 'preparation', 'occasion', 'desserts', 'easy', 'holiday-event', 'kid-friendly', 'cookies-and-brownies', 'chocolate', 'dietary', 'christmas', 'low-sodium', 'low-in-something', 'taste-mood', 'sweet']","[674.8, 30.0, 290.0, 7.0, 24.0, 59.0, 37.0]",16,"['heat oven to 350f', 'melt butter and chocolate chips in 2-quart saucepan over low heat , stirring constantly , until smooth', 'remove from heat', 'add condensed milk', 'stir until smooth', 'add flour', 'mix well', 'shape rounded teaspoonfuls of dough into 1-inch balls', 'place 1 inch apart onto ungreased cookie sheets', 'bake for 6 to 8 minutes or just until set', 'do not over bake', 'cookies may appear slightly under baked', 'cool completely', 'meanwhile , combine powdered sugar and vanilla in small bowl', 'gradually stir in enough milk for desired glazing consistency', 'drizzle over cookies']","['butter', 'milk chocolate chips', 'sweetened condensed milk', 'all-purpose flour', 'powdered sugar', 'vanilla', 'milk']",7,,,11,2005,1,5.0,autumn
246479,oregano dijon chicken,40,557057,"['60-minutes-or-less', 'time-to-make', 'course', 'main-ingredient', 'preparation', 'healthy', 'main-dish', 'poultry', 'easy', 'low-fat', 'chicken', 'dietary', 'low-saturated-fat', 'high-protein', 'high-in-something', 'low-in-something', 'meat', 'chicken-breasts']","[268.2, 7.0, 9.0, 23.0, 66.0, 7.0, 7.0]",9,"['coat chicken with dijon mustard', 'mix all other ingredients in a seperate bowl', 'dredge dijon-covered chicken in bread crumb mixture', 'spray baking dish with non-stick cooking spray', 'add chicken to baking dish', 'cover with aluminum foil', 'bake in 350 deg oven for 20 minutes', 'remove aluminum foil and bake another 10 - 15 minutes', 'bread crumbs should be golden brown and toasty']","['boneless skinless chicken breast halves', 'dijon mustard', 'dried breadcrumbs', 'parmesan cheese', 'dried oregano', 'garlic salt', 'black pepper']",7,"[1254, 2148, 2226, 5180, 2320, 3219, 590]","[[31801, 918, 15509, 5867, 5355, 21940], [592, 5552, 23488], [6167, 31950, 17169], [734, 744, 3707, 6821], [6167, 7, 4344, 6741], [15022, 6953], [1301, 11332]]",8,2007,2,4.5,summer
98099,mussels with coconut curry sauce,35,145097,"['60-minutes-or-less', 'time-to-make', 'course', 'main-ingredient', 'cuisine', 'preparation', 'occasion', 'appetizers', 'main-dish', 'fruit', 'seafood', 'asian', 'thai', 'dinner-party', 'nuts', 'dietary', 'mussels', 'coconut', 'shellfish']","[581.5, 35.0, 10.0, 63.0, 112.0, 52.0, 10.0]",10,"['in large stockpot , saute shallots and ginger for 5 minutes', 'add curry , saute 2 minutes', 'add wine , simmer 4 minutes', 'add clam juice , lime zest , and juice , simmer 4 minutes', 'add coconut milk , and simmer for 4 minutes', 'add mussels , cover pot , and steam 4 minutes , or until all or most mussels are open', 'with slotted spoon , remove mussels and place into 4 bowls', 'discard any mussels that did not open', 'add cilantro to broth , cook for 30 seconds , then spoon over mussels into bowls', 'serve']","['oil', 'shallot', 'fresh ginger', 'curry', 'white wine', 'clam juice', 'lime peel', 'lime, juice of', 'coconut milk', 'fresh mussels', 'cilantro']",11,"[4987, 6426, 2809, 2019, 7801, 1547, 4388, 4403, 1607, 2848, 1505]","[[6020], [5541, 1322], [3137, 10848], [20994], [1454, 3204], [30032, 7524], [14721, 15258], [14721, 240, 7524, 498], [21758, 5940], [3137, 680, 32731], [25, 555, 480, 15094]]",8,2004,2,2.0,summer
39652,oven fried chicken with honey butter sauce i,70,47510,"['weeknight', 'time-to-make', 'main-ingredient', 'preparation', 'poultry', 'chicken', 'dietary', 'meat', '4-hours-or-less']","[798.5, 80.0, 141.0, 28.0, 50.0, 134.0, 20.0]",9,"['pour 1 / 2 c melted butter in a baking dish', 'combine flour , paprika , salt and pepper', 'dredge chicken pieces in the flour mixture', 'put chicken pieces in the baking dish and turn to coat with butter', 'cover and bake , meaty side down , at 400 degrees for 30 minutes', 'combine 1 / 4 c melted butter , lemon juice and honey', 'after the chicken pieces have cooked for 30 minutes , turn the pieces over', 'pour the sauce over the chicken', 'bake uncovered for an additional 25-30 minutes or until chicken is done']","['butter', 'all-purpose flour', 'paprika', 'salt', 'pepper', 'chicken', 'lemon juice', 'honey']",8,"[840, 63, 5168, 6270, 5319, 1240, 4253, 3723]","[[8780], [589, 260, 4001, 17918], [712, 941, 3012], [6953], [11332], [5867], [13249, 7524], [4017]]",9,2002,15,4.466666666666667,autumn
399796,pan fried tilapia from sandra lee,12,1207515,"['weeknight', '15-minutes-or-less', 'time-to-make', 'course', 'main-ingredient', 'cuisine', 'preparation', 'occasion', 'north-american', 'main-dish', 'seafood', 'fish', 'inexpensive']","[145.3, 19.0, 0.0, 26.0, 2.0, 20.0, 2.0]",10,"['heat oven to 300 degrees f', 'in a shallow baking dish combine flour , seafood seasoning , salt and pepper', 'add the tilapia and lightly coat each side', 'heat oil in a large skillet over medium-high heat', 'shake off any excess seasoned flour and place in the skillet', 'brown on both sides , about 2 to 3 minutes per side', 'place tilapia on a baking sheet that is lined with a paper grocery bag or paper towels and keep warm in the oven while you prepare the sauce', 'turn down the heat to the pan the tilapia was cooked to low and add the butter', 'once the butter is melted , add the garlic , lemon juice and parsley and saute for 2 minutes', 'place the fillets on serving plates or a platter , top with the sauce and serve']","['all-purpose flour', 'seafood seasoning', 'salt', 'fresh ground black pepper', 'tilapia fillets', 'canola oil', 'butter', 'garlic', 'lemon juice', 'fresh parsley leaves']",10,"[63, 6358, 6270, 2816, 7178, 1043, 840, 3184, 4253, 2857]","[[589, 260, 4001, 17918], [26286, 29471, 484], [6953], [3137, 1430, 1301, 11332], [536, 564, 12613, 2226, 3531], [2274, 10841, 6020], [8780], [15022], [13249, 7524], [3137, 734, 5612, 3674]]",11,2009,6,5.0,autumn
398514,katie couric s lemon chicken,35,37449,"['celebrity', 'weeknight', '60-minutes-or-less', 'time-to-make', 'course', 'main-ingredient', 'cuisine', 'preparation', 'occasion', 'north-american', 'very-low-carbs', 'main-dish', 'poultry', 'american', 'greek', 'european', 'dinner-party', 'chicken', 'dietary', 'low-calorie', 'low-carb', 'northeastern-united-states', 'low-in-something', 'meat', 'chicken-breasts', 'novelty']","[304.1, 25.0, 5.0, 31.0, 59.0, 27.0, 2.0]",13,"['pound chicken breasts with a meat pounder to a uniform thickness', 'dredge lightly in flour , shaking off excess', 'in a large saute pan over medium high heat , melt the butter and oil until it sizzles', 'add the chicken breasts and saute , turning once or twice , until cooked through and juices run clear', 'remove chicken and set aside', 'whisk in flour and cook for 1 minute until the mixture boils', 'add the lemon juice to the chicken broth and whisk into the saute pan', 'reduce heat to a simmer', 'return the chiken to the pan to heat through , thickening sauce to desired consistency', 'season to taste with salt and pepper', 'serve the chicken on a bed of basmati rice and spoon the sauce over the chicken', 'garnish with chopped parsley and lemon slices', 'enjoy !']","['boneless skinless chicken breasts', 'flour', 'butter', 'olive oil', 'lemons', 'chicken broth', 'salt and pepper', 'cooked basmati rice', 'fresh parsley', 'lemon slice']",10,"[1252, 2683, 840, 5006, 4231, 1257, 6276, 1701, 2856, 4271]","[[31801, 918, 15509, 5867, 6285], [17918], [8780], [10444, 6020], [30295], [5867, 24176], [6953, 488, 11332], [9649, 2911, 1019, 249, 6878], [3137, 734, 5612], [13249, 8654]]",11,2009,10,4.9,autumn
277945,canja  cape verde islands   rich chicken   rice soup,60,143001,"['60-minutes-or-less', 'time-to-make', 'course', 'main-ingredient', 'cuisine', 'preparation', 'occasion', 'north-american', 'main-dish', 'soups-stews', 'poultry', 'rice', 'african', 'american', 'easy', 'beginner-cook', 'heirloom-historical', 'holiday-event', 'chicken', 'stove-top', 'one-dish-meal', 'northeastern-united-states', 'meat', 'whole-chicken', 'pasta-rice-and-grains', 'short-grain-rice', 'equipment', '3-steps-or-less']","[570.8, 41.0, 11.0, 28.0, 65.0, 38.0, 15.0]",5,"['saute onions in oil', 'next add chicken pieces , boullion cubes and saute a few minutes more', 'add 3 cups of water to the pan and bring to a boil', 'simmer 30 to 35 minutes , until rice is cooked', 'add water to adjust to desired consistency']","['whole chicken', 'onions', 'chicken bouillon cubes', 'short-grain white rice', 'vegetable oil', 'water']",6,"[7819, 5010, 1248, 6464, 7557, 7655]","[[1657, 5867], [19414], [5867, 6168, 4386, 504, 22118], [1938, 260, 13569, 1454, 6878], [17869, 6020], [1353]]",1,2008,2,4.5,winter
248897,low fat pumpkin angel food cake,55,390058,"['60-minutes-or-less', 'time-to-make', 'course', 'preparation', 'for-large-groups', 'healthy', 'desserts', 'low-fat', 'cakes', 'dietary', 'low-cholesterol', 'low-saturated-fat', 'healthy-2', 'low-in-something', 'number-of-servings']","[109.3, 0.0, 50.0, 5.0, 5.0, 0.0, 8.0]",11,"['preheat oven to 350f', 'in a large bowl combine pumpkin , vanilla , cinnamon , nutmeg , cloves and ginger', 'prepare cake according to the package directions', 'fold 1 / 4 of the batter into the pumpkin mixture', 'gently fold in the remaining batter', 'gently spoon the batter into a 10"" tube pan', 'cut through the batter with a knife to remove any air pockets', 'bake on the lowest rack for 38 - 44 minutes until golden brown and cake springs back when lightly touched', 'invert on a wire rack immediately', 'cool for one hour until completely cool', 'run knife around the sides and invert on plate']","['pumpkin puree', 'vanilla', 'cinnamon', 'nutmeg', 'ground cloves', 'ginger', 'angel food cake mix']",7,"[5760, 7449, 1511, 4964, 3498, 3248, 912]","[[18376, 673, 944], [15000], [15341], [21447, 7869], [1430, 796, 964], [10848], [3753, 2044, 5409, 7087]]",8,2007,3,4.666666666666667,summer
449634,pasta and chickpea salad,25,286566,"['30-minutes-or-less', 'time-to-make', 'course', 'main-ingredient', 'preparation', 'occasion', 'for-1-or-2', 'lunch', 'pasta', 'vegetables', 'easy', 'beginner-cook', 'diabetic', 'picnic', 'vegetarian', 'dietary', 'brown-bag', 'pasta-rice-and-grains', 'to-go', 'number-of-servings', '3-steps-or-less']","[518.6, 6.0, 27.0, 16.0, 38.0, 3.0, 37.0]",2,"['cook the pasta in a small saucepan of boiling water following the packet directions and then drain and rinse under cold water and then drain well and transfer to an airtight container', 'add chickpeas , corn , cucumber , capsicum , pesto and parsley to the pasta and season with pepper and toss the combine']","['pasta', 'chickpeas', 'corn kernels', 'lebanese cucumber', 'red capsicum', 'pesto sauce', 'parsley', 'fresh ground black pepper']",8,,,2,2011,1,4.0,winter
37069,good potatoes,100,50281,"['weeknight', 'time-to-make', 'main-ingredient', 'preparation', 'occasion', '5-ingredients-or-less', 'potatoes', 'vegetables', 'oven', 'easy', 'potluck', 'dinner-party', 'holiday-event', 'dietary', 'christmas', 'new-years', 'to-go', 'equipment', '4-hours-or-less']","[365.2, 44.0, 4.0, 14.0, 18.0, 83.0, 6.0]",4,"['mix all ingredients together except the cheese', 'sprinkle the cheese on top', 'bake 60-90 minutes at 325-350f', 'baking time is important']","['frozen hash browns', 'butter', 'half-and-half', 'salt', 'parmesan cheese']",5,"[3021, 840, 3589, 6270, 5180]","[[4787, 20826, 24610], [8780], [1444, 260, 488, 260, 1444], [6953], [734, 744, 3707, 6821]]",8,2002,2,4.5,summer
122707,new england dinner au gratin,85,86141,"['time-to-make', 'course', 'main-ingredient', 'preparation', 'main-dish', 'vegetables', 'vegetarian', 'dietary', 'one-dish-meal', '4-hours-or-less']","[180.6, 3.0, 24.0, 13.0, 21.0, 6.0, 10.0]",9,"['place cabbage , potatoes , carrots , and leeks in a 4-quart dutch oven', 'sprinkle spices over vegetables and mix well', 'add water', 'bring mixture to a boil over medium heat , stirring occasionally', 'cover , reduce heat to low , and simmer 30 minutes', 'preheat oven to 350 degrees', 'spread cheese evenly over cooked vegetables', 'place in oven and bake , covered , 25 minutes', 'serve as is or over any cooked grain']","['cabbage', 'potatoes', 'carrots', 'leeks', 'caraway seed', 'paprika', 'garlic powder', 'salt', 'pepper', 'water', 'low-fat cheddar cheese']",11,"[893, 5648, 1093, 4227, 1078, 5168, 3217, 6270, 5319, 7655, 1168]","[[25905], [10837], [21570], [9911, 742], [857, 841, 10107], [712, 941, 3012], [15022, 8361], [6953], [11332], [1353], [954, 260, 4739, 30645, 4785, 6821]]",5,2005,4,3.5,spring
255734,acorn squash and kale over penne,30,283251,"['30-minutes-or-less', 'time-to-make', 'course', 'main-ingredient', 'preparation', 'occasion', 'main-dish', 'pasta', 'vegetables', 'fall', 'vegetarian', 'winter', 'dietary', 'seasonal', 'pasta-rice-and-grains', 'penne', 'pasta-shells', 'greens', 'squash', 'presentation', 'served-hot']","[288.2, 10.0, 0.0, 12.0, 21.0, 12.0, 16.0]",14,"['place squash in a casserole dish with 1 / 4 cup water', 'cover with plastic wrap', 'microwave 7 minutes on high or until tender', 'heat oil in a dutch oven over medium-high heat', 'add garlic', 'cook 1 minute , stirring constantly', 'add kale and broth', 'cover', 'cook 3 minutes , stirring occasionally', 'uncover', 'cook 1 minute', 'stir in the salt , pepper , and nutmeg', 'stir in squash and pasta , tossing gently', 'sprinkle with cheese']","['acorn squash', 'water', 'olive oil', 'garlic cloves', 'kale', 'vegetable broth', 'salt', 'crushed red pepper flakes', 'nutmeg', 'cooked penne', 'parmesan cheese']",11,"[26, 7655, 5006, 3203, 4024, 7550, 6270, 1986, 4964, 1742, 5180]","[[34512, 23841], [1353], [10444, 6020], [15022, 796, 964], [27, 1515], [17869, 24176], [6953], [6945, 978, 11332, 14071], [21447, 7869], [9649, 1922, 2066], [734, 744, 3707, 6821]]",9,2007,2,5.0,autumn
49444,golden syrup candy  like hokey pokey,25,59064,"['30-minutes-or-less', 'time-to-make', 'course', 'cuisine', 'preparation', 'occasion', 'south-west-pacific', 'low-protein', 'healthy', '5-ingredients-or-less', 'desserts', 'easy', 'kid-friendly', 'low-fat', 'candy', 'dietary', 'gluten-free', 'low-cholesterol', 'low-saturated-fat', 'new-zealand', 'free-of-something', 'low-in-something', 'number-of-servings']","[319.6, 0.0, 248.0, 53.0, 0.0, 0.0, 28.0]",6,"['bring the sugar and the golden syrup to the boil , slowly stirring all the time', 'boil for 7 minutes , stirring occasionally', 'remove from heat and add soda', 'stir in quickly until it froths and pour at once into a greased tin', 'break up when cold', 'store in an airtight tin']","['sugar', 'baking soda', 'golden syrup']",3,,,12,2002,11,4.909090909090909,winter
