recipe_id,name,minutes,contributor_id,tags,nutrition,n_steps,steps,ingredients,n_ingredients,ingredient_ids,ingredient_tokens,month,year,num_comments,avg_ratings,season
103021,coriander and mint chutney,15,6357,"['15-minutes-or-less', 'time-to-make', 'course', 'main-ingredient', 'cuisine', 'preparation', 'occasion', 'condiments-etc', 'vegetables', 'asian', 'indian', 'easy', 'no-cook', 'beginner-cook', 'dinner-party', 'vegan', 'vegetarian', 'dietary', 'spicy', 'inexpensive', 'taste-mood', 'equipment', 'small-appliance', 'mixer', 'technique']","[18.8, 0.0, 9.0, 0.0, 1.0, 0.0, 1.0]",7,"['put the corriander and mint leaves alongwith the green chillies and a little water in your mixer and process until you have a smooth paste', 'remove from mixer into a serving bowl', 'add salt and sugar', 'stir in lemon juice', 'serve alongside cutlets , kebabs , etc', 'or as a sandwich spread', 'enjoy !']","['fresh coriander leaves', 'fresh mint leaves', 'green chilies', 'black salt', 'sugar', 'fresh lemon juice']",6,"[2784, 2846, 3418, 595, 6906, 2832]","[[3137, 1055, 11, 4364, 3674], [3137, 13331, 3674], [2056, 955, 2763], [1301, 6953], [6444], [3137, 13249, 7524]]",11,2004,1,5.0,autumn
333564,pastry shell for 11  fruit or quiche tarts,20,666306,"['30-minutes-or-less', 'time-to-make', 'course', 'main-ingredient', 'cuisine', 'preparation', 'occasion', 'north-american', '5-ingredients-or-less', 'pies-and-tarts', 'desserts', 'american', 'easy', 'dinner-party', 'crusts-pastry-dough-2', 'grains', 'pasta-rice-and-grains', 'brunch', '3-steps-or-less']","[178.9, 18.0, 6.0, 3.0, 4.0, 36.0, 5.0]",12,"['place flour , sugar , and salt in food processor bowl', 'add butter slices', 'process , using rapid on / off pulces until mixture resembles small particles', 'add 1 tablespoon of water', 'process a couple seconds more', 'add other tablespoon water', 'pulse again the dough should be damp enough to form a rough mass', 'add a few more drops of water if necessary', 'roll dough out onto a generously floured work surface until it is about 1 / 8 inch thick', 'cut dough into shape of tart pan and transfer to pan , patting some of the overhang in around the edge to make the sides of the shell thicker than the bottom', 'trim off remaining overhang', 'the quiche / tart is now ready to be filled and baked']","['all-purpose flour', 'sugar', 'salt', 'unsalted butter', 'cold water']",5,"[63, 6906, 6270, 7367, 1645]","[[589, 260, 4001, 17918], [6444], [6953], [563, 31331, 8780], [1705, 1353]]",10,2008,2,5.0,autumn
193132,holiday chicken salad,20,371497,"['30-minutes-or-less', 'time-to-make', 'course', 'main-ingredient', 'preparation', 'occasion', 'appetizers', 'lunch', 'poultry', 'easy', 'holiday-event', 'spreads', 'chicken', 'dietary', 'christmas', 'sandwiches', 'meat', 'chicken-breasts', 'brunch']","[147.4, 11.0, 9.0, 8.0, 29.0, 7.0, 1.0]",5,"['in a medium bowl , mix together mayonnaise with paprika and seasonings', 'blend in dried cranberries , celery , bell pepper , onion , and nuts', 'add chopped chicken , and mix well', 'season with black pepper to taste', 'chill 1 hour']","['cooked chicken breasts', 'fat-free mayonnaise', 'paprika', 'dried cranberries', 'celery', 'green onions', 'green bell pepper', 'pecans', 'seasoning salt', 'ground black pepper']",10,"[1708, 4623, 5168, 2251, 1124, 6335, 3399, 5298, 6374, 3486]","[[9649, 5867, 6285], [4739, 260, 1964, 1061, 494, 813, 2141], [712, 941, 3012], [6167, 10207, 11125], [38139], [2056, 19414], [2056, 4178, 11332], [8467, 1179], [29471, 484, 6953], [1430, 1301, 11332]]",10,2006,3,4.333333333333333,autumn
50720,pork with rice,55,64605,"['60-minutes-or-less', 'time-to-make', 'course', 'main-ingredient', 'preparation', 'casseroles', 'main-dish', 'pork', 'vegetables', 'oven', 'easy', 'grains', 'dietary', 'low-carb', 'low-in-something', 'meat', 'pasta-rice-and-grains', 'equipment']","[587.1, 38.0, 9.0, 32.0, 98.0, 41.0, 12.0]",7,"['sprinkle pork with season salt and pepper', 'brown in skillet with oil', 'place in 9 x 13 pan', 'place sliced onion on top of pork', 'in a bowl mix soup , milk , and rice', 'spread over top of pork and onions', 'cover and bake at 350 for 30-40 minutes']","['pork loin roast', 'oil', 'condensed cream of mushroom soup', 'milk', 'cooked rice', 'yellow onion', 'season salt', 'pepper']",8,"[5592, 4987, 1674, 4717, 1746, 7979, 6361, 5319]","[[12395, 40118, 14259], [6020], [34904, 4914, 498, 22193, 8294], [5940], [9649, 6878], [3484, 21453], [7033, 6953], [11332]]",1,2003,2,4.0,winter
53897,turkey pasta pie,60,49304,"['60-minutes-or-less', 'time-to-make', 'course', 'main-ingredient', 'cuisine', 'preparation', 'occasion', 'savory-pies', 'main-dish', 'eggs-dairy', 'pasta', 'poultry', 'vegetables', 'oven', 'easy', 'european', 'potluck', 'dinner-party', 'kid-friendly', 'italian', 'cheese', 'turkey', 'stove-top', 'dietary', 'one-dish-meal', 'comfort-food', 'meat', 'pasta-rice-and-grains', 'broccoli', 'onions', 'taste-mood', 'to-go', 'equipment']","[350.6, 23.0, 19.0, 29.0, 49.0, 36.0, 9.0]",19,"['preheat oven to 350 degrees', 'cook turkey and onion in 10-inch skillet over medium heat , stirring occasionally , until turkey is no longer pink', 'drain', 'stir in tomatoes , tomato sauce and italian seasoning', 'heat to boiling', 'reduce heat , cover and simmer 10 minutes', 'stirring occasionally', 'meanwhile , cook and drain fettuccine as directed on package', 'beat 1 egg and the butter in medium bowl', 'stir in fettuccine and mozzarella cheese', 'spoon mixture into ungreased pie plate , 10x1 1 / 2 inches', 'press evenly on bottom and up side', 'mix cottage cheese and 1 egg', 'spread over fettuccine mixture in pie plate', 'sprinkle with broccoli', 'spoon turkey mixture evenly over top', 'sprinkle with parmesan cheese', 'bake uncovered about 30 minutes or until hot in center', 'let stand 10 minutes before cutting']","['ground turkey', 'onion', 'stewed tomatoes', 'tomato sauce', 'italian seasoning', 'fettuccine', 'egg', 'butter', 'mozzarella cheese', 'small curd cottage cheese', 'broccoli', 'parmesan cheese']",12,"[3548, 5010, 6819, 7233, 3940, 2592, 2499, 840, 4836, 6537, 756, 5180]","[[1430, 12038], [21453], [36845, 19811], [16954, 10734], [8300, 29471, 484], [629, 3, 915, 23512, 745], [8441], [8780], [593, 1648, 37151, 6821], [1220, 1039, 248, 7673, 6821], [32043], [734, 744, 3707, 6821]]",2,2003,2,5.0,winter
72581,golden tofu salad with carrots and hijiki,50,83511,"['60-minutes-or-less', 'time-to-make', 'course', 'main-ingredient', 'cuisine', 'preparation', 'occasion', 'appetizers', 'lunch', 'side-dishes', 'snacks', 'beans', 'asian', 'japanese', 'picnic', 'vegan', 'vegetarian', 'dietary', 'soy-tofu', 'to-go']","[138.7, 16.0, 9.0, 21.0, 15.0, 8.0, 1.0]",13,"['in a small saucepan , soak hijiki for 10 minutes', 'once rehydrated , simmer the seaweed uncovered for 20 minutes or until the water has evaporated', 'remove from heat and allow to cool', 'meanwhile , drain the tofu and slice the cake horizontally', 'place between sheets of paper towels and put on a cutting board with a heavy weight atop the tofu to press away excess water', 'a cast iron skillet or heavy book is ideal', 'drain the tofu for at least 15 minutes', 'cut into cubes and brown evenly on all sides using 1 tabblespoon of sesame oil', 'remove from pan and sprinkle with tamari', 'set aside to cool', 'in a large bowl , whisk together vinegar , oil , ginger , and salt', 'add seaweed , tofu , and veggies', 'toss well and allow flavors to marry for at least 30 minutes']","['dried hijiki seaweed', 'water', 'firm tofu', 'sesame oil', 'soy sauce', 'fresh ginger', 'rice vinegar', 'sea salt', 'carrots', 'scallions']",10,"[2277, 7655, 2643, 6413, 6696, 2809, 6082, 6352, 1093, 6335]","[[6167, 490, 7823, 4552, 24903], [1353], [3677, 571, 15534], [559, 1164, 6020], [37754, 10734], [3137, 10848], [6878, 26285], [2761, 6953], [21570], [5703, 6237]]",10,2003,3,3.3333333333333335,autumn
57681,tastes like tuna,5,8606,"['15-minutes-or-less', 'time-to-make', 'course', 'main-ingredient', 'preparation', 'for-1-or-2', '5-ingredients-or-less', 'lunch', 'beans', 'easy', 'vegetarian', 'dietary', 'sandwiches', 'chick-peas-garbanzos', 'number-of-servings', '3-steps-or-less']","[663.1, 22.0, 29.0, 71.0, 43.0, 9.0, 38.0]",2,"['pulse all ingredients in a food processor until chunky , about the consistency of tuna salad', 'serve on toast or bread !']","['garbanzo beans', 'mayonnaise', 'brown mustard', 'green onions', 'sweet pickle relish']",5,,,4,2003,1,4.0,spring
98576,ginger rum pork roast,90,101034,"['time-to-make', 'course', 'main-ingredient', 'preparation', 'occasion', 'main-dish', 'pork', 'oven', 'dinner-party', 'one-dish-meal', 'meat', 'equipment', '4-hours-or-less']","[94.1, 6.0, 35.0, 14.0, 0.0, 12.0, 3.0]",9,"['preheat oven to 350 degrees', 'combine salt , pepper , garlic pwdr and paprika and rub all over the pork', 'place pork in roasting pan and bake for 1 hr 15 minutes', 'in small saucepan heat brown sugar , rum or o', 'j', ', butter , mustard , vinegar and ginger', 'simmer whisking until consistency of jam and reduced to 1 / 4 cup', 'brush glaze over roast during last 15 minutes of cooking time', 'let stand about 10 minutes before you slice it']","['bone-in pork roast', 'salt', 'pepper', 'garlic powder', 'paprika', 'dark brown sugar', 'dark rum', 'butter', 'dijon mustard', 'apple cider vinegar', 'fresh ginger']",11,"[678, 6270, 5319, 3217, 5168, 2045, 6212, 840, 2148, 155, 2809]","[[3870, 260, 500, 12395, 14259], [6953], [11332], [15022, 8361], [712, 941, 3012], [1294, 2507, 6444], [1294, 12404], [8780], [592, 5552, 23488], [7304, 24329, 26285], [3137, 10848]]",8,2004,1,0.0,summer
334890,cream cheese and chipped beef dip,5,430471,"['15-minutes-or-less', 'time-to-make', 'course', 'preparation', 'for-large-groups', '5-ingredients-or-less', 'appetizers', 'easy', 'spreads', 'number-of-servings', '3-steps-or-less']","[52.2, 4.0, 1.0, 18.0, 11.0, 9.0, 0.0]",2,"['mix all ingredients with mixer', 'chill and serve with crackers']","['light cream cheese', 'light chive & onion cream cheese', 'chipped beef', 'worcestershire sauce', 'garlic powder']",5,,,11,2008,2,5.0,autumn
330915,curried squashy apples   leeks,135,163112,"['time-to-make', 'course', 'preparation', 'side-dishes', 'crock-pot-slow-cooker', 'equipment', '4-hours-or-less']","[188.2, 10.0, 56.0, 2.0, 5.0, 18.0, 11.0]",5,"['in a small pan , saute leeks in butter until softened then add to crockpot', 'add remaining ingredients to crockpot & stir', 'cook 1 1 / 2 - 2 hours on high until bubbly & the apples are softened', 'taste to check for seasoning', 'add salt & pepper to taste']","['butter', 'leeks', 'apples', 'butternut squash', 'apple cider', 'curry powder', 'salt & pepper']",7,"[840, 4227, 150, 875, 154, 2022, 6273]","[[8780], [9911, 742], [14389], [6796, 8619, 23841], [7304, 24329], [20994, 8361], [6953, 296, 11332]]",10,2008,1,5.0,autumn
38643,peanut butter snowballs,20,13483,"['30-minutes-or-less', 'time-to-make', 'course', 'main-ingredient', 'preparation', 'occasion', 'appetizers', 'desserts', 'lunch', 'eggs-dairy', 'fruit', 'easy', 'no-cook', 'finger-food', 'holiday-event', 'kid-friendly', 'vegetarian', 'nuts', 'freezer', 'dietary', 'equipment', 'number-of-servings', 'presentation', '3-steps-or-less', 'technique']","[1018.9, 90.0, 359.0, 22.0, 56.0, 106.0, 37.0]",3,"['combine all ingredients in a large bowl except coconut', 'shape mixture into 1""balls and roll in coconut place on baking sheet lined with wax paper and freeze', 'serve frozen']","['nuts', 'raisins', 'powdered milk', 'creamy peanut butter', 'honey', 'wheat germ', 'coconut']",7,"[4958, 5825, 5687, 1938, 3723, 7688, 1591]","[[7327], [1143, 7406], [23618, 5940], [14965, 14368, 8780], [4017], [17004, 2273, 258], [21758]]",8,2002,2,4.5,summer
8750,classic hollandaise sauce,20,7673,"['30-minutes-or-less', 'time-to-make', 'course', 'preparation', 'occasion', 'low-protein', 'very-low-carbs', 'condiments-etc', 'romantic', 'stove-top', 'dietary', 'low-carb', 'low-in-something', 'taste-mood', 'equipment']","[296.6, 50.0, 0.0, 8.0, 3.0, 100.0, 0.0]",11,"['place egg yolks and water in the top of a double boiler and beat well with a wire whip or fork', 'put all but 2 tbs of the butter in a small saucepan over moderately low heat until just melted', 'add 1 tbs of the cold butter to the egg and water mixture and place over hot , not boiling water', 'whip constantly until egg yolks thicken slightly', 'remove from heat and whip in the second tbs of cold butter', 'gradually pour the melted butter into the egg mixture , beating constantly', 'place over hot , not boiling , water cook until thickened , whipping constantly', 'thickened hollandaise should hold the imprint when a fork or whip is drawn across the surface', 'remove from heat and stir in lemon juice , salt , and cayenne', 'sauce may be placed in top of double boiler over hot , not boiling , water , covered , and kept until serving time', 'serve with vegetables , baked or broiled fish , and shell-fish']","['egg yolks', 'water', 'sweet butter', 'lemon juice', 'salt', 'cayenne pepper']",6,"[2512, 7655, 6962, 4253, 6270, 1119]","[[8441, 23748, 742], [1353], [2417, 8780], [13249, 7524], [6953], [25845, 8111, 11332]]",4,2001,7,4.428571428571429,spring
286133,lemony ham slice,20,326787,"['ham', '30-minutes-or-less', 'time-to-make', 'course', 'main-ingredient', 'preparation', 'for-1-or-2', '5-ingredients-or-less', 'main-dish', 'pork', 'easy', 'dietary', 'one-dish-meal', 'meat', 'number-of-servings']","[222.4, 0.0, 216.0, 4.0, 1.0, 0.0, 19.0]",9,"['lemon sauce: grate peel of one lemon', 'cut lemon in half', 'thinly slice one half', 'squeeze juice from other half', 'combine peel , juice , brown sugar , mustard', 'add lemon slices', 'broil ham slice 4 inches from heat for 5 minutes', 'turn and top with sauce', 'broil 3 minutes until sauce bubbles']","['lemon', 'brown sugar', 'prepared mustard', 'ham steak']",4,"[4231, 800, 4880, 3607]","[[13249], [2507, 6444], [3572, 23488], [3947, 11892]]",2,2008,2,4.5,winter
61678,roasted pineapple w balsamic glaze honey   fresh goat cheese,30,52543,"['30-minutes-or-less', 'time-to-make', 'course', 'main-ingredient', 'preparation', 'occasion', '5-ingredients-or-less', 'desserts', 'fruit', 'oven', 'easy', 'beginner-cook', 'vegetarian', 'dietary', 'low-sodium', 'low-in-something', 'tropical-fruit', 'pineapple', 'novelty', 'equipment']","[389.0, 37.0, 120.0, 13.0, 20.0, 80.0, 11.0]",5,"['coat the bottom of a baking dish with some of the butter , arrange the pineapple slices and bake at 450f for about 15- 20 minutes', 'divide the rest of the butter into the center of the pineapple slices', 'drizzle with the balsamic and bake for a further 5 minutes', 'to serve , fill the hole with the fresh goat cheese and pour some of the cooking liquid over it , then drizzle with honey', 'allow to cool to at room temperature before serving']","['pineapple', 'butter', 'balsamic vinegar', 'fresh goat cheese', 'honey']",5,"[5408, 840, 339, 2811, 3723]","[[30878], [8780], [1742, 540, 5809, 26285], [3137, 10666, 6821], [4017]]",5,2003,8,4.875,spring
393560,spring chicken casserole,90,286566,"['time-to-make', 'course', 'main-ingredient', 'cuisine', 'preparation', 'south-west-pacific', 'healthy', 'casseroles', 'main-dish', 'poultry', 'australian', 'oven', 'diabetic', 'low-fat', 'chicken', 'stove-top', 'dietary', 'one-dish-meal', 'low-sodium', 'low-cholesterol', 'low-saturated-fat', 'low-calorie', 'low-carb', 'healthy-2', 'low-in-something', 'meat', 'equipment', '4-hours-or-less']","[335.7, 15.0, 41.0, 11.0, 59.0, 8.0, 10.0]",9,"['preheat oven to 180c', 'heat the olive oil in a frying pan over a high heat', 'season the chicken with pepper on both sides and then add them to the frying pan and quickly brown on both sides', 'remove chicken and drain on paper towel and then transfer to a large casserole dish', 'reduce the heat and add the baby onions , carrots , the garlic , the potatoes and the mushrooms and fry for 5 minutes stirring occasionally', 'remove the vegetable from the pan with a slotted spoon and drain on kitchen paper and then add to the casserole dish', 'sprinkle the flour into the pan and then blend in the stock , stirring until thickened and then add the tomatoes and half of the chopped parsley and stir well and then add to the casserole dish', 'cover the casserole dish with a lid and cook in the oven for 45 minutes', 'serve sprinkled with the remaining chopped parsley']","['olive oil', 'boneless skinless chicken breasts', 'black pepper', 'baby onions', 'baby carrots', 'garlic clove', 'baby potatoes', 'button mushrooms', 'plain flour', 'chicken stock', 'tomatoes', 'parsley']",12,"[5006, 1252, 590, 280, 269, 3203, 283, 892, 5495, 1297, 7213, 5185]","[[10444, 6020], [31801, 918, 15509, 5867, 6285], [1301, 11332], [1924, 19414], [1924, 21570], [15022, 796, 527], [1924, 10837], [3699, 19104], [4204, 17918], [5867, 6382], [19811], [734, 5612]]",10,2009,1,4.0,autumn
68657,mama s italian salad dressing,10,45651,"['15-minutes-or-less', 'time-to-make', 'course', 'cuisine', 'preparation', 'north-american', 'salads', 'american', 'easy', 'no-cook', 'refrigerator', 'beginner-cook', 'salad-dressings', 'dietary', 'equipment', 'number-of-servings', '3-steps-or-less', 'technique']","[944.3, 140.0, 122.0, 41.0, 3.0, 59.0, 11.0]",3,"['put all ingredients into a jar and shake well', 'chill', 'enjoy !']","['sugar', 'vinegar', 'ketchup', 'lemon, juice of', 'onion', 'oil', 'celery seed', 'salt', 'paprika', 'garlic', 'fresh parsley']",11,"[6906, 7620, 4053, 4287, 5010, 4987, 1133, 6270, 5168, 3184, 2856]","[[6444], [26285], [20003], [13249, 240, 7524, 498], [21453], [6020], [38139, 10107], [6953], [712, 941, 3012], [15022], [3137, 734, 5612]]",8,2003,1,5.0,summer
24889,rhubarb grunt,70,17608,"['weeknight', 'time-to-make', 'course', 'main-ingredient', 'preparation', 'occasion', 'low-protein', 'desserts', 'eggs-dairy', 'fruit', 'oven', 'easy', 'potluck', 'heirloom-historical', 'holiday-event', 'kid-friendly', 'romantic', 'dietary', 'low-sodium', 'seasonal', 'comfort-food', 'low-in-something', 'taste-mood', 'to-go', 'equipment', 'number-of-servings', '4-hours-or-less']","[337.2, 28.0, 97.0, 6.0, 5.0, 57.0, 13.0]",8,"['preheat oven to 375 degrees f', 'grease a shallow 8x12 baking dish with butter , set on a baking sheet', 'spread the chopped rhubarb over the bottom of the baking dish', 'sprinkle with the sugar , coating evenly', 'dot with the butter', 'sift the flour , sugar and salt into a mixing bowl , gently stir in the cream to make a sticky dough spread this mixture over the fruit , covering evenly', 'bake for 45 minutes or until the fruit is bubbling and the top is golden', 'serve with cream , ice cream or custard']","['fresh rhubarb', 'sugar', 'unsalted butter', 'cake flour', 'salt', 'heavy cream']",6,"[2876, 6906, 7367, 911, 6270, 3668]","[[3137, 29624, 20081], [6444], [563, 31331, 8780], [5409, 17918], [6953], [2262, 4914]]",4,2002,2,5.0,spring
76329,traditional pumpkin pie,60,42367,"['60-minutes-or-less', 'time-to-make', 'course', 'main-ingredient', 'preparation', 'occasion', 'pies-and-tarts', 'desserts', 'fruit', 'oven', 'fall', 'holiday-event', 'pies', 'nuts', 'thanksgiving', 'seasonal', 'equipment']","[520.7, 41.0, 178.0, 19.0, 22.0, 70.0, 20.0]",11,"['preheat oven to 425', 'with mixer beat pumpkin , eagle brand , eggs , spices and salt', 'pour into crust', 'bake 15 minutes', 'reduce oven temperature to 350', 'bake 35 to 40 minutes longer', 'cool', 'garnish as desired', 'refrigerate leftovers', 'sour cream topping: in medium bowl , combine sour cream , sugar and vanilla extract', 'after pie has bake 30 minutes at 350 , spread sour cream topping evenly over top bake 10 minutes']","['9 inch pie shell', 'pumpkin', 'eagle brand condensed milk', 'eggs', 'ground cinnamon', 'ground ginger', 'ground nutmeg', 'salt', 'sour cream', 'sugar', 'vanilla extract']",11,"[5381, 5753, 2486, 2499, 3497, 3512, 3527, 6270, 6654, 6906, 7470]","[[291, 3652, 7056, 6515], [18376], [10770, 6728, 34904, 5940], [6812], [1430, 15341], [1430, 10848], [1430, 21447, 7869], [6953], [9514, 4914], [6444], [15000, 18347]]",11,2003,3,5.0,autumn
152954,gigi s french apple pie,55,236760,"['60-minutes-or-less', 'time-to-make', 'course', 'main-ingredient', 'preparation', 'occasion', 'low-protein', 'pies-and-tarts', 'desserts', 'fruit', 'easy', 'pies', 'dietary', 'low-sodium', 'comfort-food', 'low-in-something', 'apples', 'taste-mood']","[3569.8, 237.0, 1337.0, 68.0, 53.0, 368.0, 179.0]",5,"['mix pie filling ingredients together and place in pie shell', 'mix brown sugar and flour together', 'cut in butter', 'sprinkle topping onto the filling', 'bake at 375 degrees for 45 minutes']","['pie shells', 'sugar', 'cinnamon', 'apples', 'brown sugar', 'butter', 'flour']",7,"[5381, 6906, 1511, 150, 800, 840, 2683]","[[7056, 12304], [6444], [15341], [14389], [2507, 6444], [8780], [17918]]",1,2006,4,3.5,winter
455725,beef pitas with yogurt sauce,25,383346,"['30-minutes-or-less', 'time-to-make', 'course', 'main-ingredient', 'preparation', 'main-dish', 'beef', 'eggs-dairy', 'vegetables', 'easy', 'refrigerator', 'stove-top', 'meat', 'steak', 'onions', 'equipment', '3-steps-or-less']","[257.2, 8.0, 28.0, 30.0, 19.0, 4.0, 14.0]",9,"['for sauce , in a small bowl , combine the yogurt , parsley , garlic and salt', 'cover and refrigerate until serving', 'in a large resealable plastic bag , combine the oregano , rosemary , salt and pepper', 'add beef', 'seal bag and toss to coat', 'in a large nonstick skillet , saute onion in 2 tsp oil until golden brown', 'remove and keep warm', 'saute beef in remaining oil until no longer pink', 'serve beef and onion on pitas with yogurt sauce']","['plain fat-free yogurt', 'fresh parsley', 'garlic', 'salt', 'dried oregano', 'fresh rosemary', 'pepper', 'top sirloin steak', 'sweet onion', 'olive oil', 'pita bread']",11,"[5502, 2856, 3184, 6270, 2320, 2879, 5319, 7253, 6980, 5006, 5469]","[[4204, 4739, 260, 1964, 27043], [3137, 734, 5612], [15022], [6953], [6167, 7, 4344, 6741], [3137, 17841], [11332], [1495, 35389, 40118, 11892], [2417, 21453], [10444, 6020], [3605, 246, 5339]]",5,2011,2,5.0,spring
158962,all purpose ground beef mixture  also oamc,10,168416,"['15-minutes-or-less', 'time-to-make', 'course', 'main-ingredient', 'preparation', 'very-low-carbs', 'lunch', 'main-dish', 'beef', 'easy', 'beginner-cook', 'stove-top', 'dietary', 'low-sodium', 'oamc-freezer-make-ahead', 'low-carb', 'ground-beef', 'low-in-something', 'meat', 'equipment', 'number-of-servings']","[1012.5, 104.0, 15.0, 12.0, 170.0, 133.0, 2.0]",4,"['chop up veggies using food processor', 'mix together all ingredients in large mixing bowl either by hand or using mixer until thoroughly mixed', 'seperate meat mixture into equal 1 lb', 'portions and divide into freezer bags']","['ground beef', 'onions', 'green peppers', 'red peppers', 'bell peppers']",5,"[3484, 5010, 3440, 5974, 519]","[[1430, 11434], [19414], [2056, 28062], [978, 28062], [4178, 28062]]",3,2006,1,0.0,spring
89925,popeye s fried chicken copycat,40,102724,"['60-minutes-or-less', 'time-to-make', 'course', 'main-ingredient', 'cuisine', 'preparation', 'occasion', 'north-american', 'for-1-or-2', 'low-protein', 'main-dish', 'poultry', 'american', 'southern-united-states', 'chicken', 'deep-fry', 'dietary', 'copycat', 'low-carb', 'low-in-something', 'meat', 'novelty', 'taste-mood', 'to-go', 'number-of-servings', 'technique']","[12197.4, 2044.0, 7.0, 306.0, 66.0, 886.0, 25.0]",12,"['mix all ingredients except the oil , flour , paprika , and eggs & milk , marinate overnight in an airtight container', 'in a large bowl , combine flour , salt , peppers , and paprika', 'break the eggs into a separate bowl and beat until blended slowly adding the milk', 'dip each piece of chicken into the egg and milk mixture , then coat generously with the flour', 'once the chicken is coated , place on a rack to allow the pieces to dry , 20 to 30 minutes', 'allowing the pieces to dry will provide for more even browning of the chicken', 'to fry , heat oil in dutch oven or deep fryer to medium', 'place the chicken pieces in the oil , skin side down , one piece at a time', 'leave enough space between pieces so that they are not crowded', 'this allows the pieces to cook and brown more evenly', 'continue to cook over a medium heat , turning until all sides are golden brown and the meat is cooked thoroughly', 'when the pieces finish cooking , they should be removed and placed on a paper towel to allow grease to drain']","['chicken', 'white pepper', 'cayenne pepper', 'salt', 'tabasco sauce', 'vegetable oil', 'all-purpose flour', 'paprika', 'eggs', 'milk']",10,"[1240, 7774, 1119, 6270, 7049, 7557, 63, 5168, 2499, 4717]","[[5867], [1454, 11332], [25845, 8111, 11332], [6953], [2568, 21275, 10734], [17869, 6020], [589, 260, 4001, 17918], [712, 941, 3012], [6812], [5940]]",4,2004,45,2.888888888888889,spring
